<?xml version="1.0" encoding="utf-8"?>

<ldappc xmlns="http://grouper.internet2.edu/ldappc"
        xmlns:ldappc="http://grouper.internet2.edu/ldappc"
        xmlns:xsi="http://www.w3.org/2001/XMLSchema-instance"
        xsi:schemaLocation="http://grouper.internet2.edu/ldappc classpath:/schema/ldappc.xsd">

  <targets id="ActiveDirectory">

    <target id="ad-prod" provider="provider-ad-prod" />
    <target id="ad-test" provider="provider-ad-test" />

    <object id="group" authoritative="true">
      <identifier ref="groupDn-${target}" baseId="ou=groups,dc=grouper,dc=edu" />
      <attribute name="objectclass" ref="ad-objectclass" />
      <attribute name="cn" />
      <attribute name="description" />
      <attribute name="hasMember" />
      <references name="member">
        <reference ref="members-jdbc" toObject="member" />
        <reference ref="members-g:gsa" toObject="group" />
      </references>
    </object>

    <object id="member">
      <identifier ref="memberDn-${target}" baseId="ou=people,dc=grouper,dc=edu" />
      <attribute name="isMemberOf" ref="memberIsMemberOf" />
    </object>

  </targets>

  <targets id="OpenLDAP">

    <target id="openldap-prod" provider="provider-openldap-prod" />
    <target id="openldap-test" provider="provider-openldap-test" />

    <object id="group" authoritative="true">
      <identifier ref="groupDn-${target}" baseId="ou=groups,dc=grouper,dc=edu" />
      <attribute name="objectclass" ref="openldap-objectclass" />
      <attribute name="cn" />
      <attribute name="description" />
      <attribute name="hasMember" ref="hasMember" />
      <references name="member">
        <reference ref="members-jdbc" toObject="member" />
        <reference ref="members-g:gsa" toObject="group" />
      </references>
    </object>

    <object id="member">
      <identifier ref="memberDn-${target}" baseId="ou=people,dc=grouper,dc=edu" />
      <attribute name="isMemberOf" ref="memberIsMemberOf" />
      <references name="memberOf">
        <reference ref="memberIsMemberOf" toObject="group" />
      </references>
    </object>

  </targets>
  
</ldappc>